{"schema":"mana.knowledge.search/v1","query":"circuit breaker","index":{"freshness":"current","reason":"source-file-identities-match","revision":"sha256:1111111111111111111111111111111111111111111111111111111111111111","ranking":"sqlite-fts5-bm25/v1"},"filters":{"scopes":["project"],"lifecycles":["active"]},"limits":{"results":5,"returned_bytes":4096},"results":[{"passage_id":"psg_111111111111111111111111","document_id":"doc_111111111111111111111111","title":"Payment Architecture","heading_path":["Payment Architecture"],"source_scope":"project","lifecycle_state":"active","source_reference":".mana/global/architecture.md","document_revision":"sha256:2222222222222222222222222222222222222222222222222222222222222222","passage_revision":"sha256:3333333333333333333333333333333333333333333333333333333333333333","rank":{"algorithm":"sqlite-fts5-bm25/v1","score":-1.25,"reasons":["term:circuit","term:breaker"]},"returned_bytes":35,"snippet":"Circuit breaker protects payments."}],"gaps":[],"diagnostics":[],"guarantees":{"generated_answer":false,"model_calls":0,"network_calls":0},"returned_bytes":35}
